{
  "attempts": [
    {
      "allure": {
        "available": true,
        "path": "reports/ui-final-allure",
        "sha256": "8e0b94e75549dd0992e4c8420144bad6a17d25ec22d7602c48e82446d9227e82"
      },
      "attempt_number": 1,
      "collected_nodeids": [
        "automation/web/tests/checkout/test_2026-08-medusa-ui-checkout_c0001_add_tshirt.py::test_add_tshirt[chromium]",
        "automation/web/tests/checkout/test_2026-08-medusa-ui-checkout_c0002_keep_single_line.py::test_keep_single_line[chromium]",
        "automation/web/tests/checkout/test_2026-08-medusa-ui-checkout_c0003_apply_discount.py::test_apply_discount[chromium]",
        "automation/web/tests/checkout/test_2026-08-medusa-ui-checkout_c0004_reject_discount.py::test_reject_discount[chromium]",
        "automation/web/tests/checkout/test_2026-08-medusa-ui-checkout_c0005_place_order.py::test_place_order[chromium]",
        "automation/web/tests/checkout/test_2026-08-medusa-ui-checkout_c0006_block_missing_address.py::test_block_missing_address[chromium]",
        "automation/web/tests/checkout/test_2026-08-medusa-ui-checkout_c0007_verify_desktop.py::test_verify_desktop[chromium]",
        "automation/web/tests/checkout/test_2026-08-medusa-ui-checkout_c0008_verify_mobile.py::test_verify_mobile[chromium]"
      ],
      "executed_nodeids": [
        "automation/web/tests/checkout/test_2026-08-medusa-ui-checkout_c0001_add_tshirt.py::test_add_tshirt[chromium]",
        "automation/web/tests/checkout/test_2026-08-medusa-ui-checkout_c0002_keep_single_line.py::test_keep_single_line[chromium]",
        "automation/web/tests/checkout/test_2026-08-medusa-ui-checkout_c0003_apply_discount.py::test_apply_discount[chromium]",
        "automation/web/tests/checkout/test_2026-08-medusa-ui-checkout_c0004_reject_discount.py::test_reject_discount[chromium]",
        "automation/web/tests/checkout/test_2026-08-medusa-ui-checkout_c0005_place_order.py::test_place_order[chromium]",
        "automation/web/tests/checkout/test_2026-08-medusa-ui-checkout_c0006_block_missing_address.py::test_block_missing_address[chromium]",
        "automation/web/tests/checkout/test_2026-08-medusa-ui-checkout_c0007_verify_desktop.py::test_verify_desktop[chromium]",
        "automation/web/tests/checkout/test_2026-08-medusa-ui-checkout_c0008_verify_mobile.py::test_verify_mobile[chromium]"
      ],
      "expected_nodeids": [
        "automation/web/tests/checkout/test_2026-08-medusa-ui-checkout_c0001_add_tshirt.py::test_add_tshirt[chromium]",
        "automation/web/tests/checkout/test_2026-08-medusa-ui-checkout_c0002_keep_single_line.py::test_keep_single_line[chromium]",
        "automation/web/tests/checkout/test_2026-08-medusa-ui-checkout_c0003_apply_discount.py::test_apply_discount[chromium]",
        "automation/web/tests/checkout/test_2026-08-medusa-ui-checkout_c0004_reject_discount.py::test_reject_discount[chromium]",
        "automation/web/tests/checkout/test_2026-08-medusa-ui-checkout_c0005_place_order.py::test_place_order[chromium]",
        "automation/web/tests/checkout/test_2026-08-medusa-ui-checkout_c0006_block_missing_address.py::test_block_missing_address[chromium]",
        "automation/web/tests/checkout/test_2026-08-medusa-ui-checkout_c0007_verify_desktop.py::test_verify_desktop[chromium]",
        "automation/web/tests/checkout/test_2026-08-medusa-ui-checkout_c0008_verify_mobile.py::test_verify_mobile[chromium]"
      ],
      "junit": {
        "errors": 0,
        "failures": 0,
        "path": "reports/ui-final-junit.xml",
        "sha256": "ca3fb2fed88feda7bc70c476d19220d3d3ed4799231d9c1e7dde4ed4b8fa91f2",
        "skipped": 0,
        "tests": 8
      },
      "outcomes": {
        "automation/web/tests/checkout/test_2026-08-medusa-ui-checkout_c0001_add_tshirt.py::test_add_tshirt[chromium]": "passed",
        "automation/web/tests/checkout/test_2026-08-medusa-ui-checkout_c0002_keep_single_line.py::test_keep_single_line[chromium]": "passed",
        "automation/web/tests/checkout/test_2026-08-medusa-ui-checkout_c0003_apply_discount.py::test_apply_discount[chromium]": "passed",
        "automation/web/tests/checkout/test_2026-08-medusa-ui-checkout_c0004_reject_discount.py::test_reject_discount[chromium]": "passed",
        "automation/web/tests/checkout/test_2026-08-medusa-ui-checkout_c0005_place_order.py::test_place_order[chromium]": "passed",
        "automation/web/tests/checkout/test_2026-08-medusa-ui-checkout_c0006_block_missing_address.py::test_block_missing_address[chromium]": "passed",
        "automation/web/tests/checkout/test_2026-08-medusa-ui-checkout_c0007_verify_desktop.py::test_verify_desktop[chromium]": "passed",
        "automation/web/tests/checkout/test_2026-08-medusa-ui-checkout_c0008_verify_mobile.py::test_verify_mobile[chromium]": "passed"
      },
      "result": "pass"
    }
  ],
  "code_sha": "1b822c92dc24487b03104171c0eeb7c2410a38e9",
  "collected_nodeids": [
    "automation/web/tests/checkout/test_2026-08-medusa-ui-checkout_c0001_add_tshirt.py::test_add_tshirt[chromium]",
    "automation/web/tests/checkout/test_2026-08-medusa-ui-checkout_c0002_keep_single_line.py::test_keep_single_line[chromium]",
    "automation/web/tests/checkout/test_2026-08-medusa-ui-checkout_c0003_apply_discount.py::test_apply_discount[chromium]",
    "automation/web/tests/checkout/test_2026-08-medusa-ui-checkout_c0004_reject_discount.py::test_reject_discount[chromium]",
    "automation/web/tests/checkout/test_2026-08-medusa-ui-checkout_c0005_place_order.py::test_place_order[chromium]",
    "automation/web/tests/checkout/test_2026-08-medusa-ui-checkout_c0006_block_missing_address.py::test_block_missing_address[chromium]",
    "automation/web/tests/checkout/test_2026-08-medusa-ui-checkout_c0007_verify_desktop.py::test_verify_desktop[chromium]",
    "automation/web/tests/checkout/test_2026-08-medusa-ui-checkout_c0008_verify_mobile.py::test_verify_mobile[chromium]"
  ],
  "command": "ARGUS_EXECUTED_NODEIDS=reports/ui-final-executed.json TEST_ENV=local uv run pytest <8 traceability nodeids> -p scripts.pytest_execution_evidence --junitxml=reports/ui-final-junit.xml --alluredir=reports/ui-final-allure",
  "env": "local",
  "environment_summary": {
    "name": "local",
    "path": "config/env.local.yaml",
    "sha256": "11b70b033db57fec56c24c4e6316f1b6428560385611e0d621126fc7c3809737"
  },
  "expected_nodeids": [
    "automation/web/tests/checkout/test_2026-08-medusa-ui-checkout_c0001_add_tshirt.py::test_add_tshirt[chromium]",
    "automation/web/tests/checkout/test_2026-08-medusa-ui-checkout_c0002_keep_single_line.py::test_keep_single_line[chromium]",
    "automation/web/tests/checkout/test_2026-08-medusa-ui-checkout_c0003_apply_discount.py::test_apply_discount[chromium]",
    "automation/web/tests/checkout/test_2026-08-medusa-ui-checkout_c0004_reject_discount.py::test_reject_discount[chromium]",
    "automation/web/tests/checkout/test_2026-08-medusa-ui-checkout_c0005_place_order.py::test_place_order[chromium]",
    "automation/web/tests/checkout/test_2026-08-medusa-ui-checkout_c0006_block_missing_address.py::test_block_missing_address[chromium]",
    "automation/web/tests/checkout/test_2026-08-medusa-ui-checkout_c0007_verify_desktop.py::test_verify_desktop[chromium]",
    "automation/web/tests/checkout/test_2026-08-medusa-ui-checkout_c0008_verify_mobile.py::test_verify_mobile[chromium]"
  ],
  "iteration_id": "2026-08-medusa-ui-checkout",
  "run_id": "run-20260831T072318Z-f0f7",
  "schema_version": "1.1",
  "scope": "full",
  "seed_summary": {
    "path": "shared/testdata/seed-registry.yaml",
    "sha256": "38a125cc38aafe8a718f72b7488f14a8484faa403e9f9f22e5832fac809b6cf1"
  },
  "target_summary": {
    "config_sha256": "da9278068225115f09f259a1a6016fada8b7598016e667ef9518ed69ac980451",
    "image_ids": [
      "unavailable"
    ]
  }
}
